id,label,transcription
f6049bbb-ae7928bf.mp3,disgust,para intentar tapar la incompetencia y la falta de liderazgo que está teniendo el presidente del gobierno. Sánchez es responsable de esta situación inasostenible. El efecto llamada que inauguró nada más llegar al gobierno
86f5a40a-09e99fd3.mp3,disgust,"y a que en los consejos de ministros, cuando el Gobierno era del Partido Popular, siempre estaba su apartado de Melilla. Y la educación para nosotros, para el Partido Popular, es"
17051584-71c92581.mp3,neutral,Hay muchas mujeres que no conocen ni siquiera cuál es la discriminación salarial en la que pueden estar.
e341a06b-eb9b35a1.mp3,disgust,que calla y otorga para seguir en el poder y esto es algo absolutamente inadmisible.
b8088390-2ca3f0c9.mp3,joy,"Y con Juan Diego, que me emociona muchísimo porque, joder, qué actor más espectacular, es que es un profesor."
a116e336-69a7c9ce.mp3,disgust,"aunque en el fondo no es más que un abuso. Y así no, señor Rebella."
559fb7f4-c04e18d9.mp3,disgust,"Estamos pidiendo que de los 8 millones que dedique la Consejería de Turismo que va a recibir este mes de julio, gran parte lo dedique a abaratar precios. Las familias y las empresas"
d3449032-50b2610b.mp3,neutral,"Cambiamos de escenario y de archipiélago, nos vamos a las Baleares y también durante la noche bastante movidita en este caso por las lluvias y tormentas que en Fornalux ya han generado estos"
8f8bea0f-641e6bca.mp3,sadness,"pero al cabo del tiempo, pues hablando, pues mi hermano me animó, tienes que seguir tu vida, él lo quisiera, y bueno pues, pero al principio sí me costó mucho por eso, porque"
c5f9c3d7-ae10ac3e.mp3,neutral,"usted, hola, señora Calvo, el informe del Consejo de Estado porque advertía de las graves ilegalidades del decreto de fondos europeos? Señor Iglesias, una cosa es ser de extrema izquierda y otra ser un desagradecido. Y yo creo que si Vox ha puesto en sus manos 140.000 millones de euros para"
27088424-8b52327b.mp3,neutral,Pues efectivamente con sorpresa hemos acogido todos en Andalucía esta mañana estas declaraciones del consejero de salud de Jesús Aguirre tras una comparecencia parlamentaria
8d717f08-64d553e8.mp3,neutral,La investigación de la Universidad de Stanford en Estados Unidos ha logrado trasplantar neuronas humanas modificadas al cerebro de roedores recién nacidos y han podido modificar su comportamiento. Este avance...
afb3dfea-e1b9d976.mp3,sadness,El programa de ayuda alimentaria a las personas más desfavorecidas para 2020…
8bf61843-51f41876.mp3,neutral,"En las imágenes de la zona donde ocurrió la avalancha, la Guardia Civil no aparece."
4a05be22-38f102ae.mp3,sadness,Es un trofeo del partido porque jugamos un partido muy importante después de la derrota en casa.
90bb7019-82083298.mp3,neutral,...desde el propio gobierno catalán porque la idea es que el próximo lunes se dé un paso más en la desescalada. Por eso y para llegar a la Navidad en las mejores condiciones posibles se han acelerado los cribados en la población. Sandra Izquierdo.
e3315c21-15915df7.mp3,anger,ni que el futuro de España puede estar en manos de quienes no creen en España.
f5ed83a9-c7315107.mp3,neutral,de la empresa.
6cda484b-acb1ab5f.mp3,neutral,"Extendemos los ERTE y la prestación de autónomos hasta el 31 de mayo, el último mes en el que estará vigente el estado de alarma actual."
b68c5814-7fb48912.mp3,disgust,"No hay ninguna alternativa socioeconómica puesta encima de la PESA por parte de este Gobierno, ninguna. Sin embargo, no tenían ni programa, ¿no? Iban a hacer un programa para presentarlo y jamás lo presentaron."
c8449d5f-1d28dcf3.mp3,sadness,"Pero bueno, siempre tienes la esperanza de que está herido, que te llamará o si no te llamas porque está inconsciente y lo que más tengo grabado en mi mente"
8c07a853-06aaaa0b.mp3,neutral,"Ya es oficialmente candidato para sustituir a la dimitida a listas. Rishi Sunak, ex ministro de finanzas y favorito entre los tories,"
ad3a5fb1-27658575.mp3,disgust,"Las soluciones no están en los tribunales, las soluciones tienen que estar en la política. ¿De qué sirve?"
f1d0e080-400bccda.mp3,anger,"a la gente y usando el dinero público a su antojo, seguimos construyendo una alternativa desde lo municipal y desde lo cotidiano, desde Parla, desde Mostra, desde Alcorcón."
26f65fad-65c7848d.mp3,sadness,y es tremendamente complicado.
c38b1f9b-616d7e1f.mp3,neutral,Hoy el Consejo de Ministros ha aprobado un Real Decreto Ley de medidas urgentes de apoyo a la solvencia empresarial y en materia tributaria.
c71984e9-37cae431.mp3,disgust,"a ese proyecto que, insistimos, ha sido muy pernicioso para Cataluña porque ha provocado división, ha provocado confrontación y la situación que ahora mismo estamos viviendo."
648b4d3f-c957812d.mp3,neutral,"Rusia ha detenido a Igor Murashov, director general de la central nuclear de Saporilla, situada bajo control ruso en el sureste de Ucrania. Lo ha denunciado la empresa ucraniana de la energía atómica Energoatom."
d46211df-d1e7e795.mp3,neutral,"la cohesión y la universalidad en el sistema de salud, incorporando especialmente aquellas que"
31beccf0-9deebd67.mp3,anger,"Entonces, no sé, llevamos diciendo esto desde el jueves pasado, que fue un desastre el pase de micros. El sábado no ha habido ningún cambio. Llegó hoy domingo y tampoco veo ese cambio. ¿Cuándo va a suceder?"
e3d24269-ba631909.mp3,sadness,"Y claro, al chocar la botella contra el cristal, la botella se rompe y se inflama. Y ya pasó toda la llama y todo por delante de mi cabeza. Entonces, las manos que iban agarradas al volante, pues toda la piel se quedó allí."
65005aa8-d42c7d0c.mp3,joy,Quiero agradecer muy especialmente también la labor que hace la televisión española de este país con la gente que somos productores independientes y con carácter. Gracias.
73cd7fe3-06316374.mp3,neutral,Se ha aprobado el Programa Nacional de Reasentamiento de Refugiados
f2280170-7609e538.mp3,disgust,"con un 200% de subida de la energía, ¿qué debería hacer usted y todo su Gobierno?"
b9b44456-54a8884f.mp3,anger,"60 años, hay que estar 60 años sin comer, sin pagar un solo impuesto, sin consumir absolutamente nada para hacerse millonario con el trabajo, esto es así, son matemáticas y evidentemente nadie se hace rico trabajando, es un hecho objetivo."
ca4adf86-f104a928.mp3,disgust,por una condenada por terrorismo como Merchef Guruda. ¿Qué eclipse moral está sufriendo el Partido Socialista?
c5637446-e2d26115.mp3,disgust,"Es una incoherencia porque todos han sufrido la crisis por igual. Todos son autónomos españoles, todos necesitan ayuda."
e0da5c18-ba448e11.mp3,disgust,2019 se va sin que su gobierno gobierne y sin que se haya tomado ninguna decisión relevante en Cantabria mientras la inercia positiva de las políticas del Partido Popular se acaba.
84e96ed9-c5959644.mp3,neutral,"1.300, aunque la peor cifra la encontramos en Cataluña. Allí se sobrepasan los 2.200 contagios y un día más, Andrés Izquierdo, empeoran todos los indicativos."
81f021f9-1ac12cbe.mp3,anger,"Es nuestro partido el que más se parece a España. En los años 80 se decía eso del PSOE. Si es que alguna vez lo fueron, que lo dudo, es evidente que hace décadas ya que dejaron de serlo. Hoy lo somos nosotros."
f413cd61-d80be9c3.mp3,disgust,El inicio del curso político de Sánchez será la factura de la luz que reciban muchos españoles al inicio de este mes de septiembre.
bb0b02d6-179d3a7d.mp3,joy,"el señor Da Silva Santos está junio, está marcando un gol, o sea que me consta que estaba en las labores propias de su profesión."
b5f37434-aef642ae.mp3,joy,"Bueno, este premio, como todos, es de muchísima gente, entre ellos los que nos apoyaron desde el principio, el Icaá, Televisión Española y Televisión de Cataluña, especialmente Jordi Ambrós, sin los que no estaríamos aquí. Yo lo quiero agradecer"
8d90387e-dbcec433.mp3,neutral,"Rusia anunció hoy la retirada de la estratégica ciudad de Gerson, la única capital regional bajo control ruso en toda Ucrania."
ad87ecb1-8deae742.mp3,disgust,para limitar la propiedad privada o la libertad de las personas.
0c9e245b-282b4808.mp3,sadness,"No, perdón, no. Los tengo ahí y cuanto más lejos los tenga, mucho mejor. Es más, es que los veo en televisión y tengo que cambiar automáticamente, tengo que cambiar de canal. No puedo verlo, no lo soporto."
6cf867da-8ac48fc4.mp3,disgust,en esta tercera oleada y en la segunda de la que salimos. No se puede abandonar a su suerte a estas administraciones y por supuesto no se puede tener a un ministro de Sanidad a tiempo parcial.
02e139e2-5abcbd57.mp3,neutral,El Gobierno declara hoy su sólido compromiso con la erradicación de todas las formas de trata de seres humanos mediante la adopción de medidas legales y el impulso de políticas públicas.
ca4c08f7-1b7ba446.mp3,joy,de
83b46b2f-c69b1525.mp3,joy,"Y por eso queremos recuperar el espíritu positivo de este salón del Tinel, precisamente porque es el escenario de uno de los acontecimientos más tristes de la historia del Partido Socialista."
c7cf9a04-c0b9c635.mp3,neutral,Vuelve el teletrabajo a las empresas. Los casos de coronavirus aumentan de forma imparable y muchas compañías optan por volver a trabajar desde casa al menos estas navidades. Esto supondrá un repuntio
49458461-8931a9ef.mp3,neutral,La evolución de la pandemia y las preocupaciones de los ciudadanos en este tiempo se puede seguir perfectamente a través de las búsquedas que hacemos en internet.
5ce1c3e3-fd5afad4.mp3,anger,"Con su gasolina este motor no anda, con su gasolina la economía frena y el empleo frena. Dice el Gobierno..."
1c758dce-5afdfdd4.mp3,sadness,"Me he sentido muy incómoda, realmente acosada. Sudo frío, tiembla y echas a andar cada vez más rápido. Paso ligero hasta que los pierdes de vista y te dejas en paz."
ccd126df-d190c9af.mp3,disgust,"y esa irresponsabilidad, esa imprevisión tiene unas cifras de contagio, unas cifras de incidencia que ya nos han situado"
417b6ee0-322073c4.mp3,sadness,"y que nos ha impedido hacer nuestro fútbol. Si a eso le sumamos que en la primera parte hemos estado imprecisos, no? Lo siguiente..."
22ed01e3-f75d070c.mp3,anger,"Como dijo Alfonso Alerre hace 30 años, Montesquieu está muerto y bien enterrado. En España no se elige siquiera un ejecutivo."
a413ec5f-598094da.mp3,neutral,El Consejo de Ministros ha aprobado a la Agencia Estatal de Investigación la convocatoria 2019 de tramitación anticipada de Centro de Excelencia Severo Ochoa y Unidades María de Maestu.
06f62537-74786bbd.mp3,fear,"Johnny, estás helado. ¿Qué es lo que te pasa? ¿Qué demonios te han dado?"
5fcdbbd4-b632e5a9.mp3,neutral,"Son muchos quienes estos días arriman el hombro para salir pronto de esta situación y ayudar a quien lo necesita, médicos, enfermeros, dependientes de supermercado, fuerzas de seguridad del estado y también agricultores y ganaderos. Ellos trabajan sin descanso para asegurar nuestra alimentación."
163f0991-b5d3ebe4.mp3,neutral,Más de 170 personas han muerto y decenas han resultado heridas debido a los disturbios en un partido de fútbol en Indonesia.
d9c49cfd-f1fdce70.mp3,neutral,"La Unión Europea baraja seriamente pagar a Elon Musk por el servicio de Internet Starlink, vital hoy por hoy para Ucrania."
11a360d8-7f1a6eff.mp3,anger,"4 partidos para Ancelotti, que es que sois insoportables, de verdad, Ancelotti es una mala persona, 4 partidos, os hago una lección, ¿sabéis que he dicho? Mi currículum es pitao..."
545f954c-224ccdd7.mp3,neutral,Descontento entre los finlandeses frente a la llegada de turistas rusos.
fab5d17a-9b7cb863.mp3,joy,"Querida familia, hoy vamos a preparar en cometelo una de esas recetas que le sale a todo el mundo, que nos vale para que una misma cantidad de comida parezca que es más y de hecho va a ser más y además está riquísima."
7a6e909f-9584192f.mp3,anger,"han tenido que haber frustrado sus proyectos vitales porque ustedes son unos intolerantes. Más quisieran ustedes que poder decirles a las mujeres y a las personas con quién tienen que acostarse. Después, miren, el contenido"
0af33876-e5c76cd6.mp3,neutral,"La subida del precio de la luz y de los combustibles impactan también en la cesta de la compra. Muchos productos continúan encareciéndose y todo a las puertas de la Navidad, una de las épocas de mayor gasto en nuestro país. Lucía Rodríguez."
2184d384-f55cdad5.mp3,disgust,¿Por qué experimentamos con los ciudadanos de Cantabria?
c3e16886-4078310b.mp3,neutral,El miedo al fracaso. ¿Por qué las personas nos da tanto miedo fracasar?
987f5401-9eb6d91a.mp3,disgust,"Mira, el pato por corrido es del año 2008, estamos en el 2021, han pasado 13 años, 13 años, ya se te olvida las cosas."
5e1ab615-e8fdf67f.mp3,sadness,Diciendo que mi hija estaba allí y que le habían pegado un tiro en la pierna.
81bdd9fc-baf54647.mp3,joy,y dedicárselo y agradecerlo especialmente a Dani Ecija porque confiaste una vez en mí y no sé por qué lo has vuelto a hacer.
01625692-9216e33a.mp3,anger,Sus pactos con los independentistas le inhabilitan para buscar hoy el interés general. Tiene demasiadas hipotecas con todos aquellos que desprecian lo que es la convivencia entre todos.
5041808c-afbe13a1.mp3,anger,"¿Y qué es lo que viene al final el resultado de su negociación? Que los a perpetuidad de esa cuatro años, ahora ya tres,"
81fb8d93-79cc6d34.mp3,anger,¡Qué bien se vivía contra Mariano Rajoy!
538eb963-71afe1a4.mp3,neutral,"Y hoy, en el Consejo de Ministros de Hoy, hemos aprobado un Real Decreto en virtud del cual las mascarillas dejan de ser obligatorias, salvo en determinadas excepciones."
fcebc574-d1e036b9.mp3,anger,vemos como se está perjudicando también a los usuarios del patronato porque se ha contratado también externamente una empresa de más de 16.000 euros para las nuevas inscripciones al patronato de deportes que vemos que no está sirviendo tampoco para nada.
97689a5b-f8074926.mp3,sadness,han querido quitarme la vida cuando yo no he hecho nada para que me la quiten.
d20e9bbd-02a6f3d1.mp3,joy,"Muchos elogios, todo es fantástico, todo es fantástico y vamos a otra competición."
6d504a54-9084ffc1.mp3,neutral,Están vacunados y tienen muchas ganas de viajar en Fuenlabrada en Madrid han organizado viajes para cuando se pueda a Torremolinos y Avenidor había tantas ganas que en sólo unos días ya se han reservado casi 9.000 plazas
0a447c75-0b15143d.mp3,neutral,"La inflación se situó en agosto en el 10,5 por ciento, es una décima más de lo que se preveía. El dato es inferior al de julio por la bajada de los carburantes, pero de los precios han tirado sobre todo la electricidad."
b1c53343-c4ecfd6d.mp3,disgust,"Los marineros, los ganaderos, los agricultores no son enemigos del gobierno. Y apostar por el rural es apostar por España."
d9192b4a-4235e95d.mp3,disgust,"como Esquerra y República, Nacho y Percataluña, Bildu, etcétera. ¿Qué es lo que pasa? Que necesita para seguir gobernando ese apoyo de los que van contra España."
9e897b5a-034fd181.mp3,neutral,"Lesiones dejaron una treintena de heridos, entre ellos policías mediadores del diálogo."
db1be244-161c2e67.mp3,neutral,"de la Cámara de Representantes,"
7bcbab28-4ca5a6e0.mp3,neutral,"regularmente todos los años, con algunas novedades que hemos tratado de introducir para mejorar el proceso."
c888b073-dd587a62.mp3,neutral,"Las autoridades del país aseguran que el 80% de la capital ucraniana está sin agua potable, unos ataques que se han repetido también en otras regiones del país. El gobierno ucraniano ha pedido ayuda internacional para restaurar el suministro energético dañado por los ataques."
c2834990-78b59eee.mp3,neutral,Y es que el gobierno británico ha rebajado las medidas para viajar a España y las reservas han comenzado a llegar. Lucía Rodríguez.
1f4f56fb-4e29b07d.mp3,neutral,El primer ministro italiano Mario Draghi ha abandonado anticipadamente la cumbre de la OTAN en Madrid debido a una crisis interna que está experimentando su coalición de gobierno.
8707c0c5-6e8035bb.mp3,neutral,Durante las campanadas solo tenemos 36 segundos para comernos las 12 uvas. ¿Es tiempo suficiente? Los otorrinos creen que no.
8bd774bf-af3fd50a.mp3,disgust,Lamentablemente este Gobierno no nos da un ápice de tregua con todos los problemas que ellos mismos van creando y con los que van sobresaltando la opinión pública.
3f716f93-eaee4509.mp3,sadness,"para dar donde más duele a las vidas de las mujeres, para destruir la sanidad, para destruir la educación pública, para que no tengamos un médico o una médica en urgencias, para que estén"
a09d7a70-4ddbdbd6.mp3,anger,"No lo de siempre, lavarse las manos, escaquearse, no conseguir nada."
0602a197-1891a8b1.mp3,neutral,Ya se han liberado 84.500 millones de euros de estas líneas de avales del Estado y 60.000 se han reservado justamente para estos colectivos pymes y autónomos.
56431c0a-5f11fb24.mp3,neutral,Los ejes de este plan estratégico son flexibilizar la organización de los títulos de FP. ¿Cómo flexibilizar? Pues que los títulos se puedan dar online.
2f727e43-6adfbb44.mp3,joy,"Ana, eres una persona muy informada, esto es una cosa que no hace falta que te digamos en tapeando, para que lo sepas."
7ef0a553-7b1c3908.mp3,neutral,"Compraban mascarillas en China sin las garantías sanitarias, las enviaban a Valencia y luego las distribuían por todo el país. La Guardia Civil ha retirado del mercado más de 300.000 unidades y ha desarticulado la red que se encargaba de este negocio ilegal."
8e65212b-1805c984.mp3,sadness,"amor a Talas, que era donde él temía la sede. Se encontró con un compañero y le dice, mi padre, dice, a tu padre le han asesinado, le han matado, otro igual."
b1c71148-c8cc7502.mp3,anger,va a tener que pagar 700 euros más en impuestos al año y esto sencillamente es inmoral y el Partido Popular lo va a combatir desde cualquier pequeño municipio hasta el Congreso de los Diputados porque no
dc39af84-cf45833d.mp3,neutral,Rusia libera al director de la central nuclear de Zaporizhia. El organismo internacional para la energía atómica ha anunciado que el ucraniano Igor Murashov ha sido liberado este lunes por el ejército ruso tres días después de su detención.
538c88ad-a23fecb7.mp3,neutral,¿La memoria histórica puede serlo todo?
dea599ab-08ac8616.mp3,disgust,que han hecho el Partido Socialista y en la parte que le toca al Partido Regionalista es muy perjudicial para los intereses de Cantabria.
aa7e95d5-40aeabf7.mp3,disgust,"al Frente del Comité para la Desescalada se nombra un asesor de imagen político, no un científico, ni un hipotimista, ni un médico, no, a un asesor de imagen político. ¿Por qué?"
9d206c4a-3befdd88.mp3,neutral,"Santa, muchos están pensando ya en el verano, también piensan las empresas en el verano que ya están buscando trabajadores, paz."
02ba58b9-b44d81e9.mp3,disgust,"el no por el no, nosotros no somos el no es no, nosotros no nos parecemos en nada ni al Partido Socialista"
01485f49-7a2c5310.mp3,disgust,"Ayer en Moncloa hubo lazos amarillos, molesquines, bolígrafos reivindicativos, tratamiento de jefe de Gobierno al señor Torra, que recordemos que llegaba a Moncloa con su sentencia de inhabilitación bajo el brazo."
13fa85c1-7aa0d38c.mp3,anger,"Han ganado a Juve, que nosotros en 180 minutos no le podemos meter ni un gol. Y el Cano con nuestra MSN, y le han metido 4, y le han bailado Buffon, el gran Buffon, 4, le han torpedado. Y Cristiano..."
dc56fafe-a8b79e71.mp3,disgust,"Mire, que el separatismo estaba dispuesto incluso a negociar con Putin con tal de lograr sus objetivos, algunos lo intuíamos, hoy lo sabemos."
acd2b884-d6b86290.mp3,neutral,"Acostumbrada al bullicio, a la gente, al ajetreo..."
f06083b9-abd735d6.mp3,neutral,"El Consejo de Ministros ha aprobado la reforma del sistema del carnet de conducir por puntos, un carnet que estaba en vigor desde el año 2005 y es ese que todos y todas habitualmente llevamos en nuestras carteras."
04de1d85-cd84f442.mp3,disgust,de reglamento europeo para la gestión de los fondos comunitarios.
fd92ba57-86d4bcca.mp3,disgust,"todos los huecos y preguntas que se trasladan desde los grupos de la oposición, pues en el pleno de hoy..."
50353c78-cfab1fd3.mp3,disgust,y parece que hubo un compromiso de hacer ese frente común.
b618d707-648dee85.mp3,disgust,"un proyecto de gobierno, un proyecto de centro derecha, un proyecto diametralmente opuesto."
a6778bcf-f908f616.mp3,neutral,"Hay un poco de acuerdo, Lucía, sobre las pensiones de los autónomos. Se tienen que reunir de nuevo en unos días, pero lo que está claro es que la reforma de las pensiones va a penalizar las jubilaciones anticipadas a"
af431ce6-93a5a487.mp3,disgust,asistía a la comisión que se ha creado en el Senado para tratar de los problemas de la insularidad. Iba como invitado por haber sido presidente de la ciudad
b0f89987-c7063fe7.mp3,neutral,China prolonga sus maniobras militares alrededor de Taiwán.
874e0283-c9b408e8.mp3,neutral,Evitar un nuevo Chernobyl
b1031128-27a4360a.mp3,sadness,y nos tirotearon en la puerta de casa. Nos pegaron tres tiros en la puerta de casa.
3e77d202-ef00542b.mp3,neutral,España está en el noveno puesto de un ranking que lideran Suecia y Dinamarca y en los últimos puestos
c024a485-b182e06d.mp3,joy,"Hoy tenemos por favor, hoy recién salido de unos cartones, estaba pasando muchísimo calor y he dicho..."
830151d8-61a6b1b0.mp3,neutral,de la mesa.
b90728c5-efd0414d.mp3,anger,"al colectivo, olvidando la intención inicial de protección del colectivo y la utiliza como herramienta política únicamente para que el PSOE se tense."
1deda156-be5de966.mp3,neutral,"El Gobierno, en esta conmemoración y con el acuerdo que hemos adoptado en el día de hoy, con el plan que desarrolla nuestra tarea y nuestro trabajo en los próximos años, quiere estar"
c481ff38-c286918b.mp3,neutral,El presidente de Emiratos Árabes Unidos visita a Putin. Es un viaje que hace rechinar los dientes a muchas cancillerías occidentales.
3cdb3c11-8481eee0.mp3,sadness,"A todas las víctimas del franquismo, hombres y mujeres, familiares, en nombre del Gobierno de España les pido disculpas."
e8ee2692-9d8cc5dd.mp3,disgust,Es increíble qué capacidad de teatralizar algo en la que no se está diciendo la verdad a todos los ciudadanos y también es muy sorprendente cómo otros callan y otorgan.
bc61537f-7715de41.mp3,sadness,"Al poco tiempo me ha intentado Juan Bravo, un poco el de República Dominicana. Juan Bravo había trabajado conmigo."
038f25f2-a63453c8.mp3,joy,El momento de fundarse el chándal.
33237ed3-a5589eeb.mp3,neutral,Sexto día sin agua potable en la capital de Mississippi.
5224ff65-6188a9da.mp3,anger,"Señorías, les pido silencio, por favor."
3bc598b4-2a32e20c.mp3,joy,"Muchas gracias, Toni. Muchas gracias, Elisenda. Muchas gracias a todos. Le paso la palabra a Guilán. Guapos."
843b2a51-528a5db7.mp3,neutral,"La renta mínima, Adolfo Izquierdo, ¿qué más sabemos hoy de esa ayuda?"
8c73c09d-069b5604.mp3,disgust,El Gobierno pretende despachar a las familias y a las empresas con unas medidas incoherentes con la grave situación que están viviendo y que estamos viviendo.
a5fc7e0d-092d6b52.mp3,neutral,Lucas Enco se sube al carro de la invasión.
f40da792-c80fb027.mp3,disgust,que miles de autónomos y miles de empresas no han tenido para hacer frente a sus deudas.
50e3724a-b986bf18.mp3,neutral,Aún no es el momento de hablar de república en Australia.
e65e1d39-0eb4c8c1.mp3,joy,"Yo creo que este premio lo agradezco doblemente porque se premia el discurso de un videoclip, de una canción de Tus ojos, pero es el discurso de mi vida."
6a0c8bd9-83a928d1.mp3,sadness,"Pues sí, nos vamos sin Copa y..."
fb077fc9-7ebef459.mp3,neutral,Hoy es el día del defensor de la patria en Rusia y el presidente Putin ha participado en el homenaje a los caídos. En un vídeo a los militares
381808b0-35924128.mp3,neutral,"El 20% de la producción china está parada y eso tiene muchas consecuencias. Aquí se dedican a reparar teléfonos y ya nos dicen que faltan algunas piezas. Además, hoy vamos a intentar comprar un teléfono de alta gama. ¿Lo conseguiremos?"
31491167-54241a1d.mp3,sadness,"a que, aunque sea tarde, diez años tarde, llamando a la puerta en el último minuto, encontremos una solución."
88ef9abc-68aed156.mp3,neutral,Estamos hablando de un proyecto de ley de formación profesional que bien justifica una legislatura.
4d11a0f3-c838565f.mp3,anger,Hoy siento auténtica vergüenza de tener el alcalde que tengo en Torremolinos y de tener esos compañeros de corporación municipal que anteponen los intereses personales a los intereses de la ciudadanía.
608d7fa2-7075c7c4.mp3,neutral,"Vamos con más noticias. Otro de los asuntos de este día es el divorcio de Bill Gates y de Melinda Gates, que son dos figuras, ya ven ustedes, muy muy influyentes en la política."
fd81c7d5-07740862.mp3,disgust,"de la Junta de Extremadura, que es la que más ha estado en el sector de la educación"
c6653dc6-c0115b53.mp3,neutral,Rusia ya no tiene el control total de ninguna de las cuatro provincias ucranianas que se anexionó ilegalmente la semana pasada.
a80c1edc-d239ee84.mp3,neutral,Los niveles de polen están disparados en España. 21 provincias registran índices muy altos provocados por la lluvia de la sudor de hace unas semanas y el calor de los últimos días. Los alérgicos dan buena fe de ese incremento.
b00458a9-7402e5d2.mp3,neutral,"Preocupando, por eso se ha habilitado la sala multiusos del Auditorio de Zaragoza para atender a contagiados asintomáticos. Sandra Izquierdo."
8beaef45-2ed184cc.mp3,anger,"Mire, en comisión, si usted tuviera la dignidad y el respeto, que le recuerdo, es ministro de Asuntos Exteriores, de todos los españoles, incluso a los que usted odia."
