id,label,transcription
1b429fdd-d4323737.mp3,anger,"Si el equipo no tiene raza, no tiene orgullo, qué más da 4, 3, 3, que 4, 4, 2, que 4, 7, 18. Da lo mismo, porque un equipo es como la vida, hay que tener actitud."
2309a649-5eb4dc77.mp3,anger,"Exactamente comentó, y abro comillas, en la cabecita de alguno dirigente de esa monarquía corrupta, esta Canaria. Claro, cuando yo leí esto pensé, oye, ¿sabrá algo que nosotros no sabemos?"
664ed9ee-b2869fc3.mp3,disgust,"En otros deendasuntos, el Partido Popular apoya la concentración de SADCE para este miércoles día 30, a las 11 de la mañana, en frente de la delegación del Gobierno. Entre sus reivindicaciones está"
dec82798-6e270302.mp3,anger,para frustrar otra vez el cambio que podía haber llegado a Andalucía hace cuatro años y que no ha llegado por culpa de los miedos y las cobardías del PP.
c1102489-10a74840.mp3,neutral,La ONU concluye que se han cometido crímenes de guerra en Ucrania desde el inicio de la invasión rusa.
2054639d-72682aef.mp3,neutral,"Dragonés también pone en duda el rechazo de Pedro Sánchez a ese referéndum, Sandra Higierdo."
ab6072f9-54eed169.mp3,disgust,con todas las asociaciones y colectivos que trabajan en el ámbito de la salud mental en Ceuta y en Melilla.
19c5cb71-c2ccb01d.mp3,disgust,"Y hay muchas personas que tienen que aplicar esas medidas, como por ejemplo el sector de las gasolineras, que se pregunta cómo lo va a aplicar."
f0ff4de8-2ccf180a.mp3,neutral,"El ex líder soviético Mikhail Gorbachev, responsable de las reformas que ayudaron a terminar la Guerra Fría y a desintegrar la Unión Soviética, fue enterrado este sábado en el cementerio moscovita en Novodevichi, en un acto en el que estuvieron presentes familiares más cercanos."
3452ad84-bf6dedd6.mp3,neutral,"Salvar el acuerdo del grano es la prioridad de Occidente desde la retirada de Rusia, la ONU, Turquía y Ucrania."
bac73def-bc7bbc9c.mp3,joy,"Familias, esta tarde vamos a preparar en Cometelo pizza casera con una masa casera que vamos a hacer con trucos para que quede bien rica."
dce7438d-b583ca0a.mp3,joy,gracias bueno el mítico y saquino ha podido venir está con lumbago en casa el pobre estamos muy muy contentos por este premio que todo el equipo técnico todo el equipo artístico me
650d88b2-dc008cc7.mp3,neutral,La votación se iba a celebrar en este pleno del Congreso de Tamaulipas.
79fb88f3-cf1ee53d.mp3,neutral,"Más peces muertos en el río Oder, que desde hace semanas ha quedado devastado por una contaminación industrial de origen aún desconocido. En el puerto turístico de Zygadzicze, en Polonia,"
0e89b435-c4eb80f7.mp3,neutral,"dialogar, amarrar los apoyos necesarios para que el estado de alarma sea aprobado por los grupos parlamentarios, de manera que, como he dicho, la seguridad y la salud de los españoles esté por encima de ninguna otra cuestión."
881e3f75-3aebf0bf.mp3,disgust,"Sin competencias, un ministro sin competencias."
1d6c07f5-8f0b7b3f.mp3,joy,"Bueno, yo me he traído algo aquí apuntado. Por supuesto, gracias a la Academia, a Making Dog, Silvia y Juan Antonio, al programa europeo Dog Nomads."
5e02508f-c4a18ca2.mp3,neutral,"Recolecta de alimentos, ropa y otros productos de primera necesidad. A esto se dedica este fin de semana un grupo de jóvenes palmeros que vive aquí en Madrid. Pense a la distancia, no se querían"
390c548f-a0ab0da0.mp3,neutral,"Conocemos a Victoria, estudia un doble grado de derecho y economía y además trabaja."
6cd669ee-0ac5c6d3.mp3,sadness,meses después del contagio tengo unas secuelas graves o gravísimas que han destrozado mi vida mi vida y no sé si
b6103288-bdc554b7.mp3,joy,"Agradecer a mi hermano Víctor Juánez y a la oficina de Paloma Juanes que llevan 20 años apoyándome y dragándose todo lo que les he echado encima. A Sal, mi amor, gracias por acompañarme."
0b1d20fc-cb73fa7c.mp3,sadness,La sensación es que jugábamos ante un equipo que no iba a obligar mucho y sabíamos que el trabajo defensivo
96d6887a-b06fe60d.mp3,neutral,Ucrania celebra este miércoles su Día de la Independencia y Bruselas y las instituciones europeas han querido sumarse a la celebración como muestra de apoyo.
2f7f411a-0fe511cb.mp3,neutral,"Retirada masiva de las tropas rusas en el frente de Gerson, al otro lado del río Nipro."
2cb29b60-68de5082.mp3,neutral,"He venido a echarles una mano, un refuerzo en un momento en el que creo que hace falta y a mí me representa muy poco esfuerzo y mucha satisfacción personal."
35c10d04-5eaf1605.mp3,anger,"la ley de autonomía del paciente. Y es el paciente el que decide, ni los médicos, ni los enfermeros, ni los políticos, ni nadie decide, decide la persona. Y esta ley es garantista para que esto sea así. Y se"
80dcbd9e-5557ade1.mp3,anger,"Para hablar de corrupción, señores del Gobierno miren a su bancada. El PSOE de Simancas con un millón de euros de financiación ilegal. Lecciones, ninguna."
c7bb6d98-9746ced6.mp3,neutral,"donde medio centenar de transportistas se han concentrado en los accesos al puerto y en Navarra, donde los transportistas secundan una nueva marcha lenta por la ciudad."
dd612dda-a572f85d.mp3,neutral,Ucrania podrá exportar grano de nuevo a través del Mar Negro y lo hará además en condiciones
3298f555-10af9741.mp3,neutral,El principal aliado de Vladimir Putin en la región preocupa a las autoridades ucranianas. Los guardas fronterizos en el límite con Bielorrusia están reforzando sus posiciones.
2800dadb-fd0b52b2.mp3,anger,El plástico me ha roto los gemas. Porque son errores de estos que no deberían ocurrir.
f46113a9-cf84252d.mp3,disgust,"Da igual la coyuntura epidemiológica y sanitaria, da igual si había vacuna o no la había, da igual con estado de alarma o sin él o con mascarilla o sin ella, ustedes siempre en el extremo, instalados en el cerrojazo económico incluso como medida preventiva."
011d6fdb-57b5e92c.mp3,joy,"Y tenemos que dar las gracias a Beltrán Regifo y a Esteban Bolado, que han currado en este corto."
c641c521-79d6ab3a.mp3,disgust,"Comprendemos el hartazo de los ciudadanos con un gobierno instalado en el ordeno y mando, incapaz de dialogar con otras administraciones y partidos,"
78b4a1ef-b02a7f7c.mp3,neutral,Estas son las peculiares habitaciones de un hotel que está a punto de abrirse en Madrid. Está formado por una especie de cápsulas que no miden más de dos metros de largo por uno y medio de ancho.
5378a1d4-e8550fa7.mp3,sadness,"Porque es imposible una niña que la están acosando prácticamente a diario, en la cual la están insultando, la están agrediendo."
8ba3be3f-83158114.mp3,disgust,de la comunidad anciana 119 días más.
f7af525d-ee1c37d4.mp3,anger,"¡Y al rey nadie le discute la corona! ¡Un respeto al rey de Madrid! Como que al marido le han regalado el champion. ¡A la reina le regalan nada! ¡Un respeto al marido! Por mi me va a pasar. ¡Con el marido ni agua! ¡Ni agua! ¡Ya está bien, hombre! ¡Marid!"
450b76cd-a269dd3e.mp3,disgust,Yo les he creído cuando decían que iban a hacer un plan de seroprevalencia
8def1a7a-82139a96.mp3,anger,"Es un desastre, es un caos su gestión. ¿Tienen dinero y son incapaces de pagar a que se lo deben?"
96abd32e-151a3dbd.mp3,joy,"Con estas dos piezas plateadas de Balmain, el look tiene de todo, escote, crop top, hombrera, raja la falda, lo único de lo que prescindió fue de sus habituales extensiones porque iba así de guapa con una bella velenita de"
bc9ed51e-eb02079e.mp3,neutral,"En Estados Unidos, el marido de Nancy Pelosi, la presidenta del Congreso, está ingresado en un hospital después de ser agredido en su casa."
957e4438-29396e92.mp3,joy,"Porque imagínate, sería imposible echar la siesta viéndolos."
51bd8d15-c82a0f72.mp3,disgust,Esa es la respuesta que hoy nos ha dado el independentismo. Parece que solamente nueve personas en toda España han tenido la red
c6ca7cc8-791a253d.mp3,joy,Queremos recuperar ese espíritu de España suma.
55172389-f40973b4.mp3,neutral,"Ahora ya Memphis ha entrado en Guadiana. Hace una semana cuando mete un gol el chaval que sale después de un año de lesión que bastante está haciendo, mete un gol..."
b16c5900-99946d4a.mp3,disgust,"a la total rendición del regionalismo, que no solo ha renunciado a defender a Cantabria del maltrato de Sánchez, sino que además lo avala y lo apoya con sus votos en el Congreso."
76efd35a-b02c1461.mp3,neutral,de la mesa.
b3e36671-d2493c89.mp3,neutral,a ver la vida va te va enseñando ya vas un poco madurando y ya ves que no
d4377de7-9cd73d1b.mp3,joy,"Buenas noches. A mí, en nombre de On Center Timing, como una de las productoras de la serie, me gustaría, en primer lugar, dar las gracias a la Cadena SER por organizar un año más estos prestigiosos premios, al jurado, por supuesto, por concedernos el galardón."
41aafe94-bd2caa1b.mp3,neutral,"Por lo demás, hoy ha llegado a nuestro país la mayor remesa de vacunas que hemos recibido hasta la fecha, más de dos millones de dosis que ya se están administrando."
caab15ac-64b79c4c.mp3,sadness,"Dos disparos me atravesaron, me tocaron la columna vertebral, uno me salió por aquí por la tráquea, el otro me salió por aquí por el lado izquierdo."
e93e8339-ebd6e9fe.mp3,sadness,"le pediría a todos que ya que han asesinado a los nuestros, que hemos sufrido tanto, que hay tantas vidas rotas en España, que el único homenaje que se le puede hacer es que no se les olvide."
dc5682e9-33c54190.mp3,joy,¿A qué juego está dedicado el Museo Furnier de Gastéis?
613a0901-d7196333.mp3,disgust,"Ustedes, señores de Gobierno, si tienen voluntad, pongan en marcha el Consejo Económico y Social, porque tienen la mayoría suficiente para hacerlo."
e5c716e1-83f1ce37.mp3,sadness,"me salí corriendo de casa con la idea de quedarme en un banco o donde fuera, no sé, me daba lo mismo."
ae58be6f-3f1b9d1a.mp3,neutral,"Sí, Javier, esa es la medida que se acaba de anunciar y con la que el Gobierno trata de ayudar a los agricultores afectados."
bd17752d-6aff9a04.mp3,neutral,Unos 98 mil rusos han cruzado a Kazajistán en la última semana tras el anuncio de la movilización parcial del presidente Vladimir Putin.
bd009194-c06a2aa8.mp3,joy,"Pues miren, nosotros la verdad es que llevamos ya varios años, llevo tres años y medio de político aquí en el Congreso de los Diputados y a mí no me han subido el sueldo ningún año."
0eefc310-d2f88a2e.mp3,neutral,"El vencedor escribe la historia, la frase atribuida a George Orwell y acuñada por Winston Churchill hace su camino en Ucrania."
2dd20fa0-a5183811.mp3,neutral,pero ya ahí como que ya tenía ya rabia
c2da0503-617fdc94.mp3,joy,"Entonces, estamos muy felices y estoy contenta de que se termine y de repente se abre un nuevo camino. Siento cierta presión, eso es verdad, pero sobre todo, peso la confianza que"
0a34b875-f999c401.mp3,neutral,"El vicegobernador impuesto por Moscú, Engersohn, ha muerto debido a un accidente de coche, según ha señalado su servicio de prensa y la agencia rusa TASS."
37b01d4a-aa5c414f.mp3,neutral,"Putin y Erdogan han conversado hoy sobre el acuerdo de explotación de grano. Según el Kremlin, el presidente ruso consideraría volver a él tras una investigación detallada sobre el ataque a Sebastopol."
a14f4b83-271690b8.mp3,joy,"Bueno, muchas gracias. No se podía tener mejor maestra de ceremonias, Anabel. Es un placer."
00680b4c-4b4b4a9e.mp3,anger,"Si usted actuase con un mínimo de responsabilidad y de sentido común –ya no digo de sentido de Estado–, una de las primeras decisiones que hubiera tomado había sido la de convocar al jefe de la oposición, a Moncloa, para informarle de qué tipo de material le fue sustraído a través del sistema Pegasus a usted."
0632992f-10cb1771.mp3,anger,"Estoy viendo a tus dos compañeros, de verdad. ¿Tenéis algún problema con las caras? ¿Habéis tomado vinagre, ácido, limón? Decidme qué os pasa."
9880443c-848da8bb.mp3,disgust,"y sobre todo de fobias personales. Estamos hablando de Melilla y Melilla está sobrando ese posicionamiento de medio envidia, rencor, fobias personales, eso está sobrando."
c0e24e3f-fa816911.mp3,joy,"De verdad, es súper lativo el talento que tiene. Hay muy pocos como él."
c5e53a6b-78ecab52.mp3,disgust,"están rompiendo la caja común de las pensiones pero están subiendo las cotidiazones sociales. Estamos en una inflación de 5,5%, estamos con un precio récord en plena ola de frío de la electricidad. Estamos con paros en la industria del motor, con paros en la industria electrointensiva."
34b9f41a-c175da7d.mp3,neutral,Y lo que ha vuelto a vivirse en un campo de fútbol es un nuevo episodio de racismo. Este era el momento en el que se lanzaba un plátano contra los jugadores de Brasil cuando celebraban un tanto frente a
a2ff5198-2fee1fe8.mp3,neutral,"Moscú ha culpado a Kiev de unas recientes explosiones en la localidad rusa de Belgorod, mientras que Ucrania niega ser la responsable y atribuye este ataque a un fallo militar ruso."
983a593e-694990e9.mp3,neutral,"Desde luego son datos muy positivos los del paro. El mejor noviembre desde el año 2008. Hablamos de casi 74.400 desempleados menos de todos los contratos que se han firmado. La mayoría, eso sí, Paz Bailón, siguen siendo temporales."
cb31f89e-3ae40467.mp3,anger,"Y sí, le ofrecí es politizar la forma de elección del Consejo del Poder Judicial y de la Fiscalía General del Estado, lo rechazaron ayer."
f2c88be1-7cf81bf7.mp3,sadness,"Eso fue horrible, horrible. Salimos de ahí, mi hermano se quería escapar porque mi hermano estaba llorando, quiero ir con mi papá, mi papá, mi papá, mi hermano."
7f4288c2-bab67aca.mp3,disgust,"Este es el precio que el señor Sánchez está dispuesto a pagar por sobrevivir el máximo tiempo posible en Moncloa, acceder al chantaje de Esquerra Republicana de Cataluña y someterse a sus exigencias."
bbbea509-80749fa6.mp3,disgust,"teniendo los datos del paro que tiene, teniendo a los agricultores y ganaderos al límite o teniendo los datos de pobreza que conocemos es, cuando menos, descortés e impropio de un presidente del Gobierno autonómico."
c0c6a1cf-b93c9de6.mp3,anger,"¿Qué desaparecen? ¿Qué pasa con la desaparición de los 15 millones de euros de las infraestructuras turísticas? ¿Qué pasa con la desaparición de los 30 millones de obras hidráulicas? ¿Qué pasa, por ejemplo, con los 3 millones de educación infantil de 0 a 3 años? Ustedes de izquierda, sensibles."
1c4bb2b0-535a40cb.mp3,sadness,"Solo quería superar aquella situación, pensaba que yo me iba a poner de pie y luchaba todos los días, todos los días, todos los días luchaba. Me acuerdo que cuando estaba ingresado en la UBI"
d5382912-0e6e3829.mp3,sadness,que eso que lo tenían que solucionar mis padres que ellos no podían hacer nada pero vamos que a la chica que me pegó la expulsaron tres días pero seguí en mi clase hasta el final del curso y tuve que seguir aguantándola. Sobre todo en el
4a227eed-3b795374.mp3,anger,y se embarquen como polizones para ir a Inglaterra y nos hundan la actividad del puerto de Santander y acabemos perdiendo las líneas como sucedió en 2020 cuando perdimos la línea de Ferry con Irlanda. ¿Usted cree que nos podemos permitir ese lujo?
9672c547-01d301c9.mp3,joy,"Feliz viernes a todos, vamos a intentar hacer un programa maravilloso con mis compañeros"
1353b9bd-0bd7f708.mp3,joy,"es que me da hasta pergota, lana"
5826a7be-7770975e.mp3,disgust,"Lo cierto es que tanto a los comunistas como a los socialistas lo único que les une es la misma cosa, que es lo que vienen haciendo en los últimos seis años y es recaudar más."
eecfecaf-ef0c8f85.mp3,sadness,"Es que todo es una cadena, entonces pedimos..."
6c334ba2-f2866e5f.mp3,neutral,"Una situación insólita, lo que ha parecido un acto laico de confesión."
074aba7a-c9ffe373.mp3,neutral,"El primer que dice, y lo digo de verdad, de corazón, que estoy orgulloso del comportamiento que ha tenido el jugador del Barça estos años, incluido a Piqué. Por eso cuando el debate se ha llevado, y me parece muy perverso, ¿cómo se puede dudar del compromiso de Piqué con la Selección? ¿Cómo se puede dudar de que Piqué lo dado por España? ¿Quién ha dudado?"
e270b6ef-9255abce.mp3,sadness,la verdad que de que la mujer es menos que el hombre y que son más débiles y eso es algo que se cambia creo yo hasta la
287a7be9-754be699.mp3,anger,El nivel de ingenuidad de tal planteamiento es de una dimensión sonrojante.
dd8dfd22-00a35ead.mp3,neutral,"A medida que progresamos en la desescalada, vamos a avanzar también en una desescalada institucional, porque los mecanismos excepcionales deberán limitar su vigencia de acuerdo con lo excepcional de la situación."
46839503-c3f19ab6.mp3,disgust,"para intentar solucionarlo, aunque vayamos diez años tarde y aunque estemos llamando a la puerta en el último minuto, en el último minuto."
35b736f8-584fd549.mp3,anger,¿Perdieron en Bruselas? Van a perder en Madrid y pronto Pablo Casado va a llegar al Gobierno de España para que por tercera vez el Partido Popular recupere la prosperidad para España. Gracias.
015a1da2-59061384.mp3,neutral,El Gobierno está preparando para 2023 una reforma de la tarifa regulada de la luz que evite las subidas y bajadas drásticas de la factura. Las nuevas tarifas no estarían ligadas a la subasta diaria sino a unos índices más estables.
430abaf9-66fac8db.mp3,neutral,Estamos aquí reivindicando una ley de residencia justa.
6592a78c-91d3b002.mp3,neutral,"De azul a la blanca, en la calle cada vez vemos más FFP2"
afa84efa-7b653c95.mp3,sadness,el personal sanitario personificados en esta Asamblea por la señora García que está aquí presente o el señor Raboso que está telemáticamente presente.
c8a3d201-39ac930a.mp3,disgust,"Porque, mire, si ya es irresponsable desestabilizar gobiernos con mentiras, es inmoral hacerlo en plena pandemia, con 200 muertos diarios,"
2139c9b7-4e7dec7b.mp3,sadness,Sobre todo volvemos a repetir gracias al chico de Senegal por lo que intentó hacer y por todo lo que hizo y darle mucho apoyo desde aquí porque sabemos que él también
3718a7cb-02be6d5d.mp3,neutral,Abascal ha presentado su España decide que consiste en la celebración de referéndum sobre inmigración y legalización de partidos independentistas o la enseñanza de castellano en colegios catalanes.
944e4604-cd8b6eb6.mp3,anger,"Usted viene aquí a querer hacer la oposición a Sánchez, pero no se preocupa y no le ha preguntado aquí al Gobierno de la Comunidad de Madrid en qué se han gastado el dinero que han recibido del Estado."
cb25c4a4-8823bf54.mp3,disgust,"Igual de falso que ese escudo social que trata de vender a los españoles, porque solo es una tabla a la deriva a la que tratan de subirse usted y el señor Sánchez en medio de un océano de incompetencia."
da300784-36e9aec6.mp3,disgust,"esas ofensas, se podría pedir más humildad al gobierno a la hora de hablar de las cifras de paro. Que el gobierno diga que son buenas cifras."
e74cdd7d-44a48da5.mp3,joy,"Bueno, solamente felicitar por vuestro talento y agradeceros tan buenos trabajos, de verdad. Un aplauso, Teodoro."
f6814e6b-d4059b76.mp3,neutral,"La crisis energética llega con la economía mundial debilitada por los efectos del COVID, el Fondo Monetario Internacional que le cicle la situación de extremadamente incierta por el encadenamiento de una crisis tras otra que vivimos estos años."
5fb57905-15aabfba.mp3,neutral,"Hay que seguir las recomendaciones, sobre todo si ustedes tienen que viajar estos días en transporte público y hay que tener mucho cuidado también cuando regresemos a nuestra casa. Les hemos preparado un puñado de consejos muy útiles para que ustedes eviten"
fcc1f7bb-27de9338.mp3,fear,"Dejadlas en paz. ¡Comedme a mí! ¡Comedme a mí, hijos de puta!"
50c5f005-db23e558.mp3,neutral,"Península de Crimea, base rusa de Saki. Estas son imágenes captadas por satélite del antes y el después de las explosiones registradas el martes en este aeródromo."
336f3265-4a01f6b0.mp3,neutral,"Sí, tremendo alivio, no sólo entre el personal sanitario sino también en el resto de pacientes. Hace poco salían por aquí."
b5590454-b4d79692.mp3,sadness,y eso no lo pudo superar. Cogí una depresión y nunca levantó cabeza y al de unos años pues falleció.
e0c0f41b-2f878434.mp3,neutral,en Zaporilla sigue un equipo de
d5816b50-87f70ce2.mp3,disgust,"y gracias al Partido Socialista a Compromís, a Podemos y a sus nuevos socios de Ciudadanos"
63fe8ad9-c0fe65f3.mp3,neutral,Ellos son los más ricos de nuestro país. Un año más el dueño de Inditex Amancio Ortega.
1394e24c-78dc0814.mp3,joy,"Sí, ese es el fallo que tiene la asociación, que los niños nos duran poco, el que más nos dura es nuestro Dibu."
689aa435-7db174d8.mp3,anger,"Y prácticamente doblando la media de desempleo de todos los países de la OCDE, le puedo garantizar que un impuesto al trabajo o subir el impuesto de sociedades o cualquier otro sablazo fiscal al que nos tiene acostumbrados su Gobierno y que no lo impone"
1511422b-840b60bd.mp3,disgust,"y que ha hecho la empresa Endesa, pues ha empezado a cortar algunos equipamientos como este, le ha quitado la luz, por lo tanto tiene que estar cerrado"
737b0bd9-8f86772d.mp3,joy,"y gracias especialmente a todas las personas que han confiado en nosotros y, sobre todo, a los oyentes que nos apoyaron en la campaña de financiación."
bb415a47-7cacb1bb.mp3,joy,"una primera parte increíble, creo que de las mejores de la temporada a nivel de"
234d3b26-686d72a8.mp3,neutral,"Y en fase 2, el resto de España. A partir de este lunes daremos publicidad a todos los informes que han avalado las decisiones previas hasta la progresión a fase 1 de todas las Comunidades Autónomas, en un esfuerzo de transparencia que ha estado siempre en el ánimo del Ministerio."
7298bea8-2d4cd82f.mp3,neutral,Los padres de Julen están a 200 metros del lugar donde se busca el pequeño.
e6cd1482-8a2f485b.mp3,anger,"Pero la nostalgia no gana nada, la nostalgia se queda en el pasado y eso te lleva pues al pesimismo."
51b7181b-9b74aac3.mp3,disgust,"Y además, no hay nada que justifique el viraje del presidente del Gobierno de manera unilateral en lo que venía siendo una política exterior consensuada con respecto al Sáhara. No hay nada que lo justifique y este documento"
aa462e56-4b6c7007.mp3,sadness,"Es que no tiene apoyo, es que se tiene que ser nosotros. No sabíamos si vamos a tener una casa para vivir."
90c210a6-f375b120.mp3,neutral,Ahora les queremos presentar a Andrés. Andrés es un gallego de 88 años que se ha convertido en uno de los modelos más famosos de internet.
ccf3bb8c-9065dc6f.mp3,neutral,Estos disturbios que han visto han terminado con 60 detenidos y 36 agentes heridos.
7e0ca539-1f21d136.mp3,joy,"Y las locuciones de los documentales de animales no son así, rollo. ¡Oh, mierda! ¡Oh, Dios mío! ¡Qué mierda! ¡Qué mierda!"
0a674376-2013075f.mp3,neutral,"Miles de ciudadanos bielorrusos viven en Ucrania. La mayoría quedaron horrorizados por la invasión y aunque apoyan plenamente a su país de acogida frente a la agresión de Moscú, muchos podrían verse obligados a abandonar Ucrania por dificultades administrativas."
f8cc8ccb-198662f6.mp3,neutral,Intercambio de misiles entre las dos Coreas en aguas opuestas. Corea del Norte comenzó esta mañana lanzando 10 misiles de prueba al mar del este o mar de Japón. Uno de los tres misiles balísticos que lanzó cayó en aguas surcoreanas.
6813b408-3dc7f8f7.mp3,joy,Porque hace algún tiempo os enseñábamos estas imágenes de un proyecto espectacular.
ab3f96ee-556168bc.mp3,neutral,"Aún así, se han tomado medidas para evitar posibles represalias. Sandra Izquierdo."
5205b44e-19b78173.mp3,sadness,jamás pensé que me pudiera tocar directamente y solamente sabes el dolor que se siente como víctima cuando te toca
cc0249f2-3c92c8fa.mp3,anger,¡Que no me voy! ¡He dicho! ¡Que he dicho que no me voy!
f417f811-a962039d.mp3,joy,Quiero compartirlo con todos estos actorazos y estos talentos que han hecho trabajos extraordinarios y que se merecen esto tanto más como más que yo.
bc4ab7f7-6df1345d.mp3,neutral,La hostelería ha recuperado los niveles de facturación anteriores a la pandemia. El problema al que se enfrentan ahora es la falta de trabajadores. Llevan demandando mano de obra desde hace muchos meses. Lucía Rodríguez.
21644bad-07e599e7.mp3,neutral,Las cámaras de seguridad que vigilan un puente peatonal en el centro de Kiev captaron el momento en el que un misil impactaba en la infraestructura durante el bombardeo ruso de este lunes sobre la capital ucraniana.
a4cc8322-a3e4e195.mp3,disgust,un país presidido por un señor que lo es.
a0655dc6-27790734.mp3,anger,"para que Sánchez deje de utilizar el dinero de los españoles para comprar votos para el PSOE. Sánchez es el único presidente de la historia de España condenado por la junta electoral. Con esos supuestos, viernes sociales que eran electorales haciendo anuncios"
73d09e05-7b231b9f.mp3,sadness,"se llenó de humo el vagón, un humo muy oscuro que no se veía, no se podía respirar."
420c2724-88437152.mp3,disgust,y por mi experiencia que llevo ya acumulada en estos 19 años que he sido presidente de la ciudad.
2e28f014-0347776d.mp3,neutral,Cuando ves esta palabra
79981dd7-3e8ac0eb.mp3,neutral,Esas profesiones también tienen que ver Adolfo Izquierdo con la situación que estamos viviendo.
1e61b9c9-12079f29.mp3,disgust,"y para escenificar simplemente una posición que no recogen los presupuestos generales del Estado. Desde nuestro punto de vista, ayer el Partido Socialista lo que hizo fue escenificar lo que no recogen los presupuestos"
26baf8d6-3990f2f0.mp3,anger,de usar y deteriorar las instituciones del Estado. ¿Está usted con las víctimas o con los verdugos? Nosotros estamos con las víctimas. ¿Y usted? Si hasta de cónomos dice...
